{
  "id": "neurofeedback-training-can-modulate-task-relevant-",
  "title": "Neurofeedback training can modulate task-relevant memory replay rate in rats",
  "biorxiv_doi": "10.1101/2022.10.13.512183",
  "published_doi": "10.7554/elife.90944.3",
  "published_venue": "eLife",
  "published_year": 2024,
  "authors": [],
  "category": "neuroscience",
  "subcategory": null,
  "paper_type": "research",
  "format": "single-column",
  "ground_truth_citation_count": 58,
  "ground_truth_figure_count": 5,
  "ground_truth_table_count": 0,
  "difficulty": "medium",
  "notes": "SUMMARYHippocampal replay – the time-compressed, sequential reactivation of ensembles of neurons related to past experience – is a key neural mechanism of memory consolidation. Replay typically coinci"
}