{
  "id": "agent-based-model-demonstrates-the-impact-of-nonli",
  "title": "Agent-based model demonstrates the impact of nonlinear, complex interactions between cytokines on muscle regeneration",
  "biorxiv_doi": "10.1101/2023.08.14.553247",
  "published_doi": "10.7554/elife.91924.3",
  "published_venue": "eLife",
  "published_year": 2024,
  "authors": [],
  "category": "bioinformatics",
  "subcategory": null,
  "paper_type": "research",
  "format": "single-column",
  "ground_truth_citation_count": 160,
  "ground_truth_figure_count": 12,
  "ground_truth_table_count": 15,
  "difficulty": "medium",
  "notes": "AbstractMuscle regeneration is a complex process due to dynamic and multiscale biochemical and cellular interactions, making it difficult to identify microenvironmental conditions that are beneficial "
}