{
  "id": "female-specific-dysfunction-of-sensory-neocortical",
  "title": "Female specific dysfunction of sensory neocortical circuits in a mouse model of autism mediated by mGluR5 and Estrogen Receptor α",
  "biorxiv_doi": "10.1101/2023.08.10.552857",
  "published_doi": "10.1016/j.celrep.2024.114056",
  "published_venue": "Cell Reports",
  "published_year": 2024,
  "authors": [],
  "category": "neuroscience",
  "subcategory": null,
  "paper_type": "research",
  "format": "single-column",
  "ground_truth_citation_count": 110,
  "ground_truth_figure_count": 7,
  "ground_truth_table_count": 0,
  "difficulty": "medium",
  "notes": "SummaryAutism manifests differently in males and females and the brain mechanisms that mediate these sex-dependent differences are unknown. Here, we demonstrate that deletion of the ASD-risk gene, Pte"
}