{
  "id": "deciphering-the-genetic-code-of-neuronal-type-conn",
  "title": "Deciphering the Genetic Code of Neuronal Type Connectivity Through Bilinear Modeling",
  "biorxiv_doi": "10.1101/2023.08.01.551532",
  "published_doi": "10.7554/elife.91532.3",
  "published_venue": "eLife",
  "published_year": 2024,
  "authors": [],
  "category": "neuroscience",
  "subcategory": null,
  "paper_type": "research",
  "format": "single-column",
  "ground_truth_citation_count": 93,
  "ground_truth_figure_count": 15,
  "ground_truth_table_count": 5,
  "difficulty": "medium",
  "notes": "AbstractUnderstanding how different neuronal types connect and communicate is critical to interpreting brain function and behavior. However, it has remained a formidable challenge to decipher the gene"
}