{
  "id": "the-ubp5-histone-h2a-deubiquitinase-counteracts-pr",
  "title": "The UBP5 histone H2A deubiquitinase counteracts PRC2-mediated repression to regulate Arabidopsis development and stress responses",
  "biorxiv_doi": "10.1101/2022.11.15.516593",
  "published_doi": "10.1038/s41467-023-44546-8",
  "published_venue": "Nature Communications",
  "published_year": 2024,
  "authors": [],
  "category": "genomics",
  "subcategory": null,
  "paper_type": "research",
  "format": "single-column",
  "ground_truth_citation_count": 50,
  "ground_truth_figure_count": 5,
  "ground_truth_table_count": 2,
  "difficulty": "medium",
  "notes": "Polycomb Repressive Complexes (PRCs) control gene expression through the incorporation of H2Aub and H3K27me3. However, there is limited knowledge about PRCs interacting proteins and their interplay wi"
}