{
  "id": "disseminating-cells-in-human-tumours-acquire-an-em",
  "title": "Disseminating cells in human tumours acquire an EMT stem cell state that is predictive of metastasis",
  "biorxiv_doi": "10.1101/2020.04.07.029009",
  "published_doi": "10.7554/eLife.90298",
  "published_venue": "eLife",
  "published_year": 2024,
  "authors": [],
  "category": "cancer_biology",
  "subcategory": null,
  "paper_type": "research",
  "format": "single-column",
  "ground_truth_citation_count": 28,
  "ground_truth_figure_count": 3,
  "ground_truth_table_count": 0,
  "difficulty": "medium",
  "notes": "Cancer stem cells (CSCs) undergo epithelial-mesenchymal transition (EMT) to drive metastatic dissemination in experimental cancer models. However, tumour cells undergoing EMT have not been observed di"
}