{
  "id": "auditory-cortex-conveys-non-topographic-sound-loca",
  "title": "Auditory cortex conveys non-topographic sound localization signals to visual cortex",
  "biorxiv_doi": "10.1101/2023.05.28.542580",
  "published_doi": "10.1038/s41467-024-47546-4",
  "published_venue": "Nature Communications",
  "published_year": 2024,
  "authors": [],
  "category": "neuroscience",
  "subcategory": null,
  "paper_type": "research",
  "format": "single-column",
  "ground_truth_citation_count": 81,
  "ground_truth_figure_count": 6,
  "ground_truth_table_count": 0,
  "difficulty": "medium",
  "notes": "ABSTRACTPerception requires binding spatiotemporally congruent multimodal sensory stimuli. The auditory cortex (AC) sends projections to the primary visual cortex (V1), which could provide signals for"
}