{
  "id": "cryo-em-structure-and-b-factorrefinement-with-ense",
  "title": "Cryo-EM structure and B-factorrefinement with ensemble representation",
  "biorxiv_doi": "10.1101/2022.06.08.495259",
  "published_doi": "10.1038/s41467-023-44593-1",
  "published_venue": "Nature Communications",
  "published_year": 2024,
  "authors": [],
  "category": "bioinformatics",
  "subcategory": null,
  "paper_type": "research",
  "format": "single-column",
  "ground_truth_citation_count": 50,
  "ground_truth_figure_count": 6,
  "ground_truth_table_count": 4,
  "difficulty": "medium",
  "notes": "Cryo-EM experiments produce images of macromolecular assemblies that are combined to produce three-dimensional density maps. It is common to fit atomic models of the contained molecules to interpret t"
}