{
  "id": "deciphering-molecular-heterogeneity-and-dynamics-o",
  "title": "Deciphering molecular heterogeneity and dynamics of human hippocampal neural stem cells at different ages and injury states",
  "biorxiv_doi": "10.1101/2023.05.15.540723",
  "published_doi": "10.7554/eLife.89507",
  "published_venue": "eLife",
  "published_year": 2024,
  "authors": [],
  "category": "neuroscience",
  "subcategory": null,
  "paper_type": "research",
  "format": "single-column",
  "ground_truth_citation_count": 81,
  "ground_truth_figure_count": 6,
  "ground_truth_table_count": 1,
  "difficulty": "medium",
  "notes": "AbstractWhile accumulated publications support the existence of neurogenesis in the adult human hippocampus, the homeostasis and developmental potentials of neural stem cells (NSCs) under different co"
}