{
  "id": "nanopore_variant_calling",
  "title": "Benchmarking reveals superiority of deep learning variant callers on bacterial nanopore sequence data",
  "biorxiv_doi": "10.1101/2024.03.15.585313",
  "published_doi": null,
  "published_venue": "eLife",
  "published_year": 2024,
  "authors": [],
  "category": "bioinformatics",
  "subcategory": null,
  "paper_type": "research",
  "format": "single-column",
  "ground_truth_citation_count": 60,
  "ground_truth_figure_count": 5,
  "ground_truth_table_count": 2,
  "difficulty": "medium",
  "notes": "Variant calling is fundamental in bacterial genomics, underpinning the identification of disease transmission clusters, the construction of phylogenetic trees, and antimicrobial resistance prediction."
}