{
  "id": "modeling-decision-making-under-uncertainty-with-qu",
  "title": "Modeling Decision-Making Under Uncertainty with Qualitative Outcomes",
  "biorxiv_doi": "10.1101/2024.08.27.609831",
  "published_doi": "10.1371/journal.pcbi.1012440",
  "published_venue": "PLOS Computational Biology",
  "published_year": 2024,
  "authors": [],
  "category": "neuroscience",
  "subcategory": null,
  "paper_type": "research",
  "format": "single-column",
  "ground_truth_citation_count": 42,
  "ground_truth_figure_count": 3,
  "ground_truth_table_count": 2,
  "difficulty": "medium",
  "notes": "AbstractModeling decision-making under uncertainty typically relies on quantitative outcomes. Many decisions, however, are qualitative in nature, posing problems for traditional models. Here, we aimed"
}