{
  "id": "dna-foundation-models",
  "title": "Benchmarking DNA Foundation Models for Genomic and Genetic Tasks",
  "biorxiv_doi": "10.1101/2024.08.16.608288",
  "published_doi": "10.1038/s41467-025-65823-8",
  "published_venue": "Nature Communications",
  "published_year": 2025,
  "authors": [
    "Haonan Feng", "Lang Wu", "Bingxin Zhao", "Chad Huff",
    "Jianjun Zhang", "Jia Wu", "Lifeng Lin", "Peng Wei", "Chong Wu"
  ],
  "category": "genomics",
  "subcategory": "computational_biology",
  "paper_type": "benchmark",
  "format": "single-column",
  "ground_truth_citation_count": null,
  "ground_truth_figure_count": null,
  "ground_truth_table_count": null,
  "difficulty": "medium",
  "notes": "Systematic benchmark of 5 DNA foundation models across 57 datasets. Dense quantitative results with clear comparison matrix. Good test of multi-model evaluation table generation."
}
