{
  "id": "ferredoxin-1-is-essential-for-embryonic-developmen",
  "title": "Ferredoxin 1 is essential for embryonic development and lipid homeostasis",
  "biorxiv_doi": "10.1101/2023.08.23.554528",
  "published_doi": "10.7554/elife.91656",
  "published_venue": "eLife",
  "published_year": 2024,
  "authors": [],
  "category": "cell_biology",
  "subcategory": null,
  "paper_type": "research",
  "format": "single-column",
  "ground_truth_citation_count": 60,
  "ground_truth_figure_count": 5,
  "ground_truth_table_count": 2,
  "difficulty": "medium",
  "notes": "Mammalian ferredoxin 1 and 2 (FDX1/2) belong to an evolutionary conserved family of iron-sulfur cluster containing proteins and act as electron shutters between ferredoxin reductase (FDXR) and numerou"
}