{
  "id": "genomics_003",
  "title": "Benchmarking clustering, alignment, and integration methods for spatial transcriptomics",
  "biorxiv_doi": "10.1101/2024.03.12.584114",
  "published_doi": "10.1186/s13059-024-03361-0",
  "published_venue": "Genome Biology",
  "published_year": 2024,
  "authors": [],
  "category": "genomics",
  "subcategory": null,
  "paper_type": "research",
  "format": "single-column",
  "ground_truth_citation_count": 55,
  "ground_truth_figure_count": 6,
  "ground_truth_table_count": 4,
  "difficulty": "medium",
  "notes": "Spatial transcriptomics (ST) is advancing our understanding of complex tissues and organisms. However, building a robust clustering algorithm to define spatially coherent regions in a single tissue sl"
}