{
  "id": "transformations-of-sensory-information-in-the-brai",
  "title": "Transformations of sensory information in the brain reflect a changing definition of optimality",
  "biorxiv_doi": "10.1101/2023.03.24.534044",
  "published_doi": "10.1371/journal.pcbi.1011783",
  "published_venue": "PLOS Computational Biology",
  "published_year": 2024,
  "authors": [],
  "category": "neuroscience",
  "subcategory": null,
  "paper_type": "research",
  "format": "single-column",
  "ground_truth_citation_count": 39,
  "ground_truth_figure_count": 5,
  "ground_truth_table_count": 0,
  "difficulty": "medium",
  "notes": "Neurons throughout the brain modulate their firing rate lawfully in response to changes in sensory input. Theories of neural computation posit that these modulations reflect the outcome of a constrain"
}