{
  "id": "spatial-transcriptomics",
  "title": "Systematic Benchmarking of High-Throughput Subcellular Spatial Transcriptomics Platforms Across Human Tumors",
  "biorxiv_doi": "10.1101/2024.12.23.630033",
  "published_doi": "10.1038/s41467-025-64292-3",
  "published_venue": "Nature Communications",
  "published_year": 2025,
  "authors": [],
  "category": "genomics",
  "subcategory": "spatial_transcriptomics",
  "paper_type": "benchmark",
  "format": "single-column",
  "ground_truth_citation_count": null,
  "ground_truth_figure_count": null,
  "ground_truth_table_count": null,
  "difficulty": "hard",
  "notes": "Multi-platform spatial transcriptomics benchmark across 5 platforms and 3 cancer types. Complex multi-metric evaluation with orthogonal CODEX and scRNA-seq ground truth. Tests ability to organize platform comparisons across 7 evaluation dimensions with nuanced trade-off discussions."
}
