{
  "id": "bioinfo_002",
  "title": "Community effort to optimize sequence-based deep learning models of gene regulation",
  "biorxiv_doi": "10.1101/2023.04.26.538471",
  "published_doi": "10.1038/s41587-024-02414-w",
  "published_venue": "Nature Biotechnology",
  "published_year": 2024,
  "authors": [],
  "category": "bioinformatics",
  "subcategory": null,
  "paper_type": "research",
  "format": "single-column",
  "ground_truth_citation_count": 55,
  "ground_truth_figure_count": 6,
  "ground_truth_table_count": 4,
  "difficulty": "medium",
  "notes": "Neural networks have emerged as immensely powerful tools in predicting functional genomic regions, notably evidenced by recent successes in deciphering gene regulatory logic. However, a systematic eva"
}