{
  "id": "a-primary-sensory-cortical-interareal-feedforward-",
  "title": "A primary sensory cortical interareal feedforward inhibitory circuit for tacto-visual integration",
  "biorxiv_doi": "10.1101/2022.11.04.515161",
  "published_doi": "10.1038/s41467-024-47459-2",
  "published_venue": "Nature Communications",
  "published_year": 2024,
  "authors": [],
  "category": "neuroscience",
  "subcategory": null,
  "paper_type": "research",
  "format": "single-column",
  "ground_truth_citation_count": 85,
  "ground_truth_figure_count": 8,
  "ground_truth_table_count": 0,
  "difficulty": "medium",
  "notes": "AbstractTactile sensation and vision are often both utilized for the exploration of objects that are within reach though it is not known whether or how these two distinct sensory systems might combine"
}