{
  "id": "drug_003",
  "title": "Proteomic prediction of diverse incident diseases",
  "biorxiv_doi": null,
  "published_doi": "10.1016/S2589-7500(24)00087-6",
  "published_venue": "Lancet Digital Health",
  "published_year": 2024,
  "authors": [],
  "category": "bioinformatics",
  "subcategory": null,
  "paper_type": "research",
  "format": "single-column",
  "ground_truth_citation_count": 50,
  "ground_truth_figure_count": 4,
  "ground_truth_table_count": 3,
  "difficulty": "medium",
  "notes": "ML on serum proteomics for 24 disease outcomes. AUC tables."
}