{
  "id": "lateral-entorhinal-cortex-subpopulations-represent",
  "title": "Lateral entorhinal cortex subpopulations represent experiential epochs surrounding reward",
  "biorxiv_doi": "10.1101/2023.10.09.561557",
  "published_doi": "10.1038/s41593-023-01557-4",
  "published_venue": "Nature Neuroscience",
  "published_year": 2024,
  "authors": [],
  "category": "neuroscience",
  "subcategory": null,
  "paper_type": "research",
  "format": "single-column",
  "ground_truth_citation_count": 74,
  "ground_truth_figure_count": 13,
  "ground_truth_table_count": 3,
  "difficulty": "medium",
  "notes": "AbstractDuring goal-directed navigation, “what” information, which describes the experiences occurring in periods surrounding a reward, can be combined with spatial “where” information to guide behavi"
}