{
  "id": "cross-species-alignment-along-the-chronological-ax",
  "title": "Cross-species alignment along the chronological axis reveals evolutionary effect on structural development of human brain",
  "biorxiv_doi": "10.1101/2024.02.27.582251",
  "published_doi": "10.7554/elife.96020",
  "published_venue": "eLife",
  "published_year": 2024,
  "authors": [],
  "category": "neuroscience",
  "subcategory": null,
  "paper_type": "research",
  "format": "single-column",
  "ground_truth_citation_count": 69,
  "ground_truth_figure_count": 13,
  "ground_truth_table_count": 1,
  "difficulty": "medium",
  "notes": "AbstractDisentangling evolution mysteries of human brain has always been an imperative endeavor in neuroscience. On the one hand, by spatially aligning the brains between human and nonhuman primates ("
}