{
  "id": "multi-day-neuron-tracking-in-high-density-electrop",
  "title": "Multi-day Neuron Tracking in High Density Electrophysiology Recordings using EMD",
  "biorxiv_doi": "10.1101/2023.08.03.551724",
  "published_doi": "10.7554/elife.92495",
  "published_venue": "eLife",
  "published_year": 2024,
  "authors": [],
  "category": "neuroscience",
  "subcategory": null,
  "paper_type": "research",
  "format": "single-column",
  "ground_truth_citation_count": 31,
  "ground_truth_figure_count": 26,
  "ground_truth_table_count": 0,
  "difficulty": "medium",
  "notes": "AbstractAccurate tracking of the same neurons across multiple days is crucial for studying changes in neuronal activity during learning and adaptation. Advances in high density extracellular electroph"
}