{
  "id": "neural-correlates-of-perceptual-similarity-masking",
  "title": "Neural Correlates of Perceptual Similarity Masking in Primate V1",
  "biorxiv_doi": "10.1101/2023.07.06.547970",
  "published_doi": "10.7554/eLife.89570",
  "published_venue": "eLife",
  "published_year": 2024,
  "authors": [],
  "category": "neuroscience",
  "subcategory": null,
  "paper_type": "research",
  "format": "single-column",
  "ground_truth_citation_count": 49,
  "ground_truth_figure_count": 16,
  "ground_truth_table_count": 1,
  "difficulty": "medium",
  "notes": "AbstractVisual detection is a fundamental natural task. Detection becomes more challenging as the similarity between the target and the background in which it is embedded increases, a phenomenon terme"
}