{
  "id": "genomics_005",
  "title": "Deep-learning-based gene perturbation effect prediction does not yet outperform simple linear baselines",
  "biorxiv_doi": "10.1101/2024.09.16.613342",
  "published_doi": "10.1038/s41592-025-02772-6",
  "published_venue": "Nature Methods",
  "published_year": 2025,
  "authors": [],
  "category": "bioinformatics",
  "subcategory": null,
  "paper_type": "research",
  "format": "single-column",
  "ground_truth_citation_count": 45,
  "ground_truth_figure_count": 6,
  "ground_truth_table_count": 4,
  "difficulty": "medium",
  "notes": "Advanced deep-learning methods, such as foundation models, promise to learn representations of biology that can be employed to predict in silico the outcome of unseen experiments, such as the effect o"
}